{
  "$schema": "../../../schemas/v3/sequence.v3.schema.json",
  "id": "d4160951-3cd6-42dc-b114-9f358ec59c0f",
  "name": "スコアID採番",
  "description": "発音採点フロー (S-3) で 1 採点につき 1 つのスコア ID を発行するシーケンス。@conv.numbering.scoreId と連動する。採番値は pronunciation_scores.id の主キーとして使用する。リセットなし (CYCLE=false)。",
  "maturity": "draft",
  "createdAt": "2026-05-04T00:00:00.000Z",
  "updatedAt": "2026-05-04T00:00:00.000Z",
  "physicalName": "seq_score_id",
  "startValue": 1,
  "increment": 1,
  "minValue": 1,
  "maxValue": 2147483647,
  "cycle": false,
  "cache": 10,
  "conventionRef": "@conv.numbering.scoreId"
}
